{
  "lesson_id": "lesson_001",
  "source_case_id": "case_001",
  "memory_type": "procedural",
  "lesson_text": "When calling search_docs, always provide a non-empty natural-language query. Never pass null or an empty string.",
  "scope": {
    "tenant": "tenant_a",
    "tool": "search_docs",
    "prompt_family": "planner",
    "tool_schema_version": "search_docs_v2"
  },
  "status": "active",
  "confidence": 0.92,
  "sensitive": false,
  "eval_leaking": false
}
